pub_date,sectionId,sectionName,webTitle,text
2015-06-08T18:11:16Z,technology,Technology,Apple Pay to launch in UK in July,"Apple Pay will come to the UK in July, Apple confirmed at its Worldwide Developers Conference in San Francisco on Monday. It will be available at more than 250,000 locations - more than the number of merchants it had in the US for last year’s launch.
Participating retailers include Marks & Spencer, Costa and Waitrose – as well as Transport for London, meaning that Tube and bus travel can be paid for with Apple’s contactless payment system. Apple Pay will be supported by more than 70% of the credit and debit cards in the UK, said Apple executive Jennifer Bailey at WWDC. The mobile payment system launched in America in 2014, alongside the iPhone 6, but has been slow to expand to other territories. Britain is the first country outside the US to have access to use Apple Pay, which lets users pay for things, both on- and offline, using just their phone or watch. When used as an offline payment system, Apple Pay works in conjunction with an NFC (near-field communications) chip found in the two newest iPhones and the Apple Watch to let users pay for goods by tapping their phones on contactless card readers in stores. In the US, the system took a marathon of deals to put together, with Apple negotiating with banks, retailers and credit card companies individually to build enough support. Elsewhere, however, the launch is expected to be much simpler because Apple Pay uses the same technology as that found in conventional contactless card readers, already common across much of Europe and Asia. But unlike contactless cards, Apple Pay includes an extra security measure – tokenisation – which ensures that the card details stored on a phone are never passed to the retailer. Instead, the payee receives a one-use “token”, which allows them to debit the payment but cannot be reused in future. Online, Apple Pay uses the same tokenisation system to speed up and secure e-commerce, letting iPhone owners pay for goods on supported websites with just a tap of their finger on the phone’s fingerprint reader. In the US, uptake of Apple Pay was strong, with more than 40% of iPhone 6 owners having used it at least once, according to Auriemma Consulting. But the service was hampered by a need to bring partners in one by one, leading to some major hold-outs: most notably Walmart, which is already waging a war against credit card firms over merchant fees and reportedly views Apple Pay as merely perpetuating an expensive system."
2015-06-08T17:58:24Z,technology,Technology,El Capitan: Apple unveils next version of OS X software,"Apple announced the latest update to its OS X desktop software on Monday, which the company says will make it faster and easier to use. OS X 10.11 El Capitan, named after a mountain within Yosemite national park, will be available as a free update in the autumn.
Apple’s Craig Federighi said it was going to be the fastest version of OS X to date: “It’s up to 1.4x faster and we’ve seen it twice as snappy switching between apps.” The company has rewritten parts of the operating system to optimise it, extending battery life and making existing computers feel faster. It will be able to open PDF documents four times faster, for instance. Apple brought its Metal graphics system from its iOS to the Mac, which Epic Games, developers of the Unreal graphics engine used by many of today’s top games, said was significantly faster and less processor intensive for rendering intensive graphics. Spotlight, Apple’s search engine, also so an upgrade with semantic searches. “Users can search for “documents I worked on last June” and it will find all the documents created in June last year on your Mac,” said Federighi. Apple has improved window management in El Capitan, including the ability to size windows to half the screen, something Microsoft’s Windows has had baked in for years but requires a third-party app such as Moom or manual rearrangement on Yosemite. Federighi said the company had made many hundreds of small changes to the rest of Apple’s core apps, including Safari which can now pin tabs within the tab bar in the corner and can load instantly."
2015-06-08T16:15:33Z,technology,Technology,Apple takes on Facebook with revamped news app,"Apple revamped its news service on Monday, making a play to take on Facebook as the two tech giants court readers and publishers to be the top platform for news. Media organisations including the Guardian, ESPN, the New York Times, Conde Nast, the Daily Mail and Hearst will produce content specifically designed for the new service, which will replace Newstand, Apple’s current news app.
“News [the app’s name] has the latest stories, articles, and posts, with over a million topics to choose from,” Susan Prescott, vice president of product marketing, told Apple’s WWDC developers’ conference. She said the service would track over 1m topics and allow readers to follow all their favourite news sources as well as using search to discover new sources. Craig Federighi, Apple’s senior vice president of software engineering, said the New York Times would initially provide 33 articles a day tailored to the service as would other publishers including ESPN and Conde Nast magazine’s including Vogue and Vanity Fair. While content will be hosted and delivered on Apple’s platform, the publishers will own the content and control the format of articles. Publishers will also be able to sell premium ads through the app and keep the revenue. The service looks similar to Flipboard, an app that serves up news and other articles in a magazine-like format, and can be tailored to location as well as other preferences. Tony Danker, international director, Guardian News & Media, said: “We’re excited to be a launch partner for Apple News. Like Apple, we are increasingly seeing a surge in demand for original, high quality journalism from millions of new readers. And we are delighted that Apple and other large platforms recognise the value and influence of Guardian journalism.”
Apple’s Newsstand, launched in 2011, was heralded as the saviour of newspaper and magazine market in the internet-connected, smartphone and tablet era. The app saw digital magazine and newspaper revenue quadruple in the first year. But more recently publishers have complained that Newsstand hides content rather than highlights it. Many have switched to standalone apps dedicated to pulling content from websites, like the Guardian app, which has offered them greater visibility both on the iPad homescreen and within stores. Publishers will now sell apps directly within the App Store like any other app, with Apple continuing to take a 30% cut of revenue from subscriptions. Within the new Flipboard-style app, publishers participating and displaying content will keep 100% of revenue for ads they sell around their content. Apple will also help sell unsold ad slots for a fee, according to the tech site Recode. The revamp comes after Facebook revamped its news service and announced it would partner with publishers to promote stories."
2015-06-08T13:26:44Z,technology,Technology,Amazon sells reasonably-priced towel set for $800 billion,"Ever thought that stepping out of the shower and drying yourself on $100 dollar bills might be just a little too ostentatious? Ever wanted to bathe in liquid gold but didn’t want to be judged in times of global austerity? Well, never fear, for Amazon is selling a $800bn towel set, or $796bn, to be fair (£521bn). We’re guessing that stockists Portlight have made a fat-fingers keyboard mistake, or someone at the company has a very, um, dry sense of humour. The towels, manufactured by Calcot Ltd and which apparently come in just the one colour – amethyst, obviously – are woven into “super soft Supima cotton loops using zero-twist technology”. We have no idea what this means either, but damn it, we need these towels. The set, ludicrously, does not come with a free serf to hand-wash the towels using miniature bottles of Fiji water, and then dry them by soft whispering of compliments into the fabric, but are machine washable and tumble dryer safe.
The set does include two “generously sized” bath towels, two hand towels and two wash cloths (otherwise known as flannels). The towers are “less prone to pilling”, which is a word we had to look up on Google. “Functional and decorative fold-over edge is added to finish off an already perfect towel”, reads the description, and at least one punter agrees. David H writes in his product review: “This is quite possibly the best towel ever made. I had to take out a second mortgage on my house and sell my children into indentured servitude but it was way worth it. The cotton alone must have been grown in heaven. Every time I dry off I feel like I’m wrapped in joy. Sometimes I will take this towel to the lake and fish jump into my boat just to be near it. Where ever you are, this towel will attract attention.” However, Jonathan M. Pryce is less than impressed: These towels cost 12-figures and they’re not even Amazon Prime eligible??” Clay P. is equivocal: It’s alright.” The average rating for the product is 3.8 stars, but we live in an imperfect world. You can order the towel set here. But, beware, postage and packaging is $4.49 shipping . Which, frankly, is a rip-off."
